{
  "$schema": "https://json-schema.org/draft/2020-12/schema",
  "additionalProperties": false,
  "properties": {
    "bangumiId": {
      "exclusiveMinimum": 0,
      "maximum": 9007199254740991,
      "type": "integer"
    },
    "episodes": {
      "items": {
        "additionalProperties": false,
        "properties": {
          "id": {
            "exclusiveMinimum": 0,
            "maximum": 9007199254740991,
            "type": "integer"
          },
          "sort": {
            "minimum": 0,
            "type": "number"
          },
          "type": {
            "maximum": 9007199254740991,
            "minimum": 0,
            "type": "integer"
          }
        },
        "required": [
          "id",
          "type",
          "sort"
        ],
        "type": "object"
      },
      "type": "array"
    },
    "locked": {
      "type": "boolean"
    },
    "overrides": {
      "items": {
        "additionalProperties": false,
        "properties": {
          "bangumiEpisodeId": {
            "exclusiveMinimum": 0,
            "maximum": 9007199254740991,
            "type": "integer"
          },
          "targets": {
            "items": {
              "oneOf": [
                {
                  "additionalProperties": false,
                  "properties": {
                    "id": {
                      "exclusiveMinimum": 0,
                      "maximum": 9007199254740991,
                      "type": "integer"
                    },
                    "type": {
                      "const": "movie",
                      "type": "string"
                    }
                  },
                  "required": [
                    "type",
                    "id"
                  ],
                  "type": "object"
                },
                {
                  "additionalProperties": false,
                  "properties": {
                    "episode": {
                      "exclusiveMinimum": 0,
                      "maximum": 9007199254740991,
                      "type": "integer"
                    },
                    "id": {
                      "exclusiveMinimum": 0,
                      "maximum": 9007199254740991,
                      "type": "integer"
                    },
                    "season": {
                      "maximum": 9007199254740991,
                      "minimum": 0,
                      "type": "integer"
                    },
                    "type": {
                      "const": "tv",
                      "type": "string"
                    }
                  },
                  "required": [
                    "type",
                    "id",
                    "season",
                    "episode"
                  ],
                  "type": "object"
                }
              ]
            },
            "type": "array"
          }
        },
        "required": [
          "bangumiEpisodeId",
          "targets"
        ],
        "type": "object"
      },
      "type": "array"
    },
    "provenance": {
      "additionalProperties": false,
      "properties": {
        "evidence": {
          "maxLength": 20000,
          "minLength": 1,
          "type": "string"
        },
        "method": {
          "enum": [
            "seed",
            "deterministic",
            "codex",
            "community"
          ],
          "type": "string"
        },
        "source": {
          "minLength": 1,
          "type": "string"
        },
        "verifiedAt": {
          "format": "date-time",
          "pattern": "^(?:(?:\\d\\d[2468][048]|\\d\\d[13579][26]|\\d\\d0[48]|[02468][048]00|[13579][26]00)-02-29|\\d{4}-(?:(?:0[13578]|1[02])-(?:0[1-9]|[12]\\d|3[01])|(?:0[469]|11)-(?:0[1-9]|[12]\\d|30)|(?:02)-(?:0[1-9]|1\\d|2[0-8])))T(?:(?:[01]\\d|2[0-3]):[0-5]\\d:[0-5]\\d(?:\\.\\d+)?(?:Z))$",
          "type": "string"
        }
      },
      "required": [
        "method",
        "source",
        "evidence",
        "verifiedAt"
      ],
      "type": "object"
    },
    "rules": {
      "items": {
        "additionalProperties": false,
        "properties": {
          "bangumiType": {
            "maximum": 9007199254740991,
            "minimum": 0,
            "type": "integer"
          },
          "end": {
            "maximum": 9007199254740991,
            "minimum": 0,
            "type": "integer"
          },
          "episodeStart": {
            "exclusiveMinimum": 0,
            "maximum": 9007199254740991,
            "type": "integer"
          },
          "season": {
            "maximum": 9007199254740991,
            "minimum": 0,
            "type": "integer"
          },
          "start": {
            "maximum": 9007199254740991,
            "minimum": 0,
            "type": "integer"
          },
          "tmdbId": {
            "exclusiveMinimum": 0,
            "maximum": 9007199254740991,
            "type": "integer"
          }
        },
        "required": [
          "bangumiType",
          "start",
          "end",
          "tmdbId",
          "season",
          "episodeStart"
        ],
        "type": "object"
      },
      "type": "array"
    },
    "schemaVersion": {
      "const": 1,
      "type": "number"
    },
    "targets": {
      "items": {
        "oneOf": [
          {
            "additionalProperties": false,
            "properties": {
              "id": {
                "exclusiveMinimum": 0,
                "maximum": 9007199254740991,
                "type": "integer"
              },
              "type": {
                "const": "movie",
                "type": "string"
              }
            },
            "required": [
              "type",
              "id"
            ],
            "type": "object"
          },
          {
            "additionalProperties": false,
            "properties": {
              "id": {
                "exclusiveMinimum": 0,
                "maximum": 9007199254740991,
                "type": "integer"
              },
              "type": {
                "const": "tv",
                "type": "string"
              }
            },
            "required": [
              "type",
              "id"
            ],
            "type": "object"
          }
        ]
      },
      "type": "array"
    }
  },
  "required": [
    "schemaVersion",
    "bangumiId",
    "locked",
    "episodes",
    "targets",
    "rules",
    "overrides",
    "provenance"
  ],
  "type": "object"
}
