{
  "bangumiId": 24618,
  "episodes": [
    {
      "id": 911377,
      "sort": 1,
      "type": 0
    }
  ],
  "locked": false,
  "overrides": [
    {
      "bangumiEpisodeId": 911377,
      "targets": [
        {
          "id": 13179,
          "type": "movie"
        }
      ]
    }
  ],
  "provenance": {
    "evidence": "Imported existing BangumiExtLinker correspondence.\n\n脚本生成逐集规则：单一本篇章节对应整部电影。",
    "method": "deterministic",
    "source": "https://github.com/Rhilip/BangumiExtLinker/blob/8f853e6bf9d6cb382448091ce3afaf2d9cdb0a3f/data/anime_map.json",
    "verifiedAt": "2026-09-15T11:35:23.844Z"
  },
  "rules": [],
  "schemaVersion": 1,
  "targets": [
    {
      "id": 13179,
      "type": "movie"
    }
  ]
}
