{
  "bangumiId": 658535,
  "episodes": [],
  "locked": false,
  "overrides": [],
  "provenance": {
    "evidence": "codex: 确认对应 TMDB 电影180831。年份、导演、配音、75分钟片长及博物馆机器人故障剧情均一致；两站日期分别对应电视首播与家庭影音发行。本 subject 覆盖单部电影，输入无章节数据，因此不建立逐集规则。\n\nhttps://www.themoviedb.org/movie/180831 (api_snapshot): TMDB 电影 180831 为同名英文动画长片，片长75分钟，导演 Kirk R. Thatcher，编剧 Bradley Zweig，席德由 Drew Massey 配音；剧情为席德与 Gabriela 赢得竞赛后提前参观新科学博物馆，与输入资料一致。\n\nhttps://www.prnewswire.com/news-releases/the-jim-henson-company-announces-tiered-release-of-sid-the-science-kid-the-movie-the-new-preschool-adventure-debuting-on-pbs-kids-march-25-and-coming-to-dvd-and-itunes-on-april-2-from-ncircle-entertainment-195650581.html (page): 制作方 The Jim Henson Company 的公告确认本片由其与九眼石、上海美术电影制片厂联合制作，2013年3月25日在 PBS KIDS 首播，4月2日发行 DVD 和 iTunes 版本。剧情包含中国获胜者 Yangyang、Niuniu，以及发生故障的机器人导游 Bobbybot，吻合 Bangumi 简介，也解释了 TMDB 日期与 Bangumi 日期的差异。",
    "method": "codex",
    "source": "https://bgm.tv/subject/658535; https://www.themoviedb.org/movie/180831; https://www.prnewswire.com/news-releases/the-jim-henson-company-announces-tiered-release-of-sid-the-science-kid-the-movie-the-new-preschool-adventure-debuting-on-pbs-kids-march-25-and-coming-to-dvd-and-itunes-on-april-2-from-ncircle-entertainment-195650581.html",
    "verifiedAt": "2026-09-19T09:29:09.923Z"
  },
  "rules": [],
  "schemaVersion": 1,
  "targets": [
    {
      "id": 180831,
      "type": "movie"
    }
  ]
}
