{
  "bangumiId": 83694,
  "episodes": [
    {
      "id": 911501,
      "sort": 1,
      "type": 0
    }
  ],
  "locked": false,
  "overrides": [
    {
      "bangumiEpisodeId": 911501,
      "targets": [
        {
          "id": 729373,
          "type": "movie"
        }
      ]
    }
  ],
  "provenance": {
    "evidence": "codex: 上映日期、片长、导演、制作公司、电影媒介及剧情相互吻合，确认对应2013年剧场版。Bangumi唯一章节对应整部TMDB电影，不涉及TV季或后续奥特曼电影。\n\nhttps://bgm.tv/subject/83694 (page): Bangumi 标注为全1话剧场版，2013年11月9日上映；导演王巍、总监督畑澤和也，动画制作蓝弧文化。剧情为五人秘密部队使用强化装甲和巨大机器人对抗外星人。\n\nhttps://www.cinematoday.jp/movie/T0018494 (page): 日本电影资料确认上映日期为2013年11月9日、片长90分钟、中日合拍CG动画；导演トミー・ウォン、总监督畑澤和也，制作公司包括BlueArc、MediaGate与Alchemy Bros.，五人部队对抗外星人的剧情吻合。\n\nhttps://www.themoviedb.org/movie/729373 (api_snapshot): TMDB电影729373《Dragon Force: The Movie／鋼鐵飛龍 電影版》上映日期2013-11-09、片长90分钟、导演Tommy Wong，三家制作公司均与日本电影资料一致；简介为五名装备纳米技术的特警遭遇外星人攻击。",
    "method": "codex",
    "source": "https://bgm.tv/subject/83694; https://www.cinematoday.jp/movie/T0018494; https://www.themoviedb.org/movie/729373",
    "verifiedAt": "2026-09-18T19:06:50.005Z"
  },
  "rules": [],
  "schemaVersion": 1,
  "targets": [
    {
      "id": 729373,
      "type": "movie"
    }
  ]
}
