{
  "bangumiId": 554228,
  "episodes": [
    {
      "id": 1494825,
      "sort": 1,
      "type": 0
    }
  ],
  "locked": false,
  "overrides": [
    {
      "bangumiEpisodeId": 1494825,
      "targets": [
        {
          "id": 1469064,
          "type": "movie"
        }
      ]
    }
  ],
  "provenance": {
    "evidence": "脚本按上映日期识别电影：以「宝可梦生态一日记」「日文名|ヒコザルと新米ポケモン研究員」搜索得到 0 个 TV、1 个电影候选；movie/1469064「宝可梦生态一日记」上映日期 2025-04-22 与 Bangumi 放送日期相差不超过 3 天，且是唯一吻合的候选。",
    "method": "deterministic",
    "source": "https://bgm.tv/subject/554228; https://www.themoviedb.org/movie/1469064",
    "verifiedAt": "2026-09-18T11:24:20.473Z"
  },
  "rules": [],
  "schemaVersion": 1,
  "targets": [
    {
      "id": 1469064,
      "type": "movie"
    }
  ]
}
