{
  "bangumiId": 54529,
  "episodes": [
    {
      "id": 889577,
      "sort": 1,
      "type": 0
    }
  ],
  "locked": false,
  "overrides": [
    {
      "bangumiEpisodeId": 889577,
      "targets": [
        {
          "id": 390931,
          "type": "movie"
        }
      ]
    }
  ],
  "provenance": {
    "evidence": "gpt-5.6-luna: TMDB 390931 的原名为「チョコレート・アンダーグラウンド」，别名包含「Chocolate Underground: Bokura no Chocolate Sensou」，上映日为 2009-01-31，片长 87 分，剧情、Production I.G/Trans Arts 制作及浜名孝行导演均与 Bangumi subject 一致，属于该剧场版的单部电影。TMDB 的 TV 44477 是 2008 年播出的 13 集短篇版，每集约 4–6 分钟，不应作为本 subject 的对应作品。\n\nhttps://api.bgm.tv/v0/subjects/54529 (api_snapshot): Bangumi 原始资料确认这是 2009-01-31 上映、87 分钟、1 话的剧场版，剧情为巧克力禁令下 Huntley、Smudger 与 Louise 的反抗。\n\nhttps://www.themoviedb.org/movie/390931 (api_snapshot): TMDB 电影 390931：原名「チョコレート・アンダーグラウンド」，日期 2009-01-31，片长 87 分；别名包含「Chocolate Underground: Bokura no Chocolate Sensou」；制作公司为 Production I.G 与 Trans Arts，导演为 Takayuki Hamana。\n\nhttps://www.themoviedb.org/tv/44477 (api_snapshot): TMDB TV 44477 是同题材的 2008 年电视短篇版，共 13 集，不能替代 2009 年 87 分钟剧场版。\n\nhttps://www.themoviedb.org/tv/44477/season/1 (api_snapshot): TV 44477 第 1 季实际集表为 13 集，每集 4–6 分钟，播出时间为 2008-06-12 至 2008-09-01。\n\n脚本生成逐集规则：单一本篇章节对应整部电影。",
    "method": "codex",
    "source": "https://bgm.tv/subject/54529; https://api.bgm.tv/v0/subjects/54529; https://www.themoviedb.org/movie/390931; https://www.themoviedb.org/tv/44477; https://www.themoviedb.org/tv/44477/season/1",
    "verifiedAt": "2026-09-15T11:35:23.844Z"
  },
  "rules": [],
  "schemaVersion": 1,
  "targets": [
    {
      "id": 390931,
      "type": "movie"
    }
  ]
}
