{
  "bangumiId": 392719,
  "episodes": [
    {
      "id": 1118894,
      "sort": 1,
      "type": 0
    }
  ],
  "locked": false,
  "overrides": [
    {
      "bangumiEpisodeId": 1118894,
      "targets": [
        {
          "id": 511547,
          "type": "movie"
        }
      ]
    }
  ],
  "provenance": {
    "evidence": "脚本按上映日期识别电影：以「Cot Cot」「咯咯」搜索得到 1 个 TV、10 个电影候选；movie/511547「Cot Cot」上映日期 2007-01-01 与 Bangumi 放送日期相差不超过 3 天，且是唯一吻合的候选。",
    "method": "deterministic",
    "source": "https://bgm.tv/subject/392719; https://www.themoviedb.org/movie/511547",
    "verifiedAt": "2026-09-18T19:06:50.005Z"
  },
  "rules": [],
  "schemaVersion": 1,
  "targets": [
    {
      "id": 511547,
      "type": "movie"
    }
  ]
}
