{
  "bangumiId": 220083,
  "episodes": [
    {
      "id": 1595980,
      "sort": 1,
      "type": 0
    }
  ],
  "locked": false,
  "overrides": [
    {
      "bangumiEpisodeId": 1595980,
      "targets": [
        {
          "id": 1448786,
          "type": "movie"
        }
      ]
    }
  ],
  "provenance": {
    "evidence": "gpt-5.6-luna: TMDB 1448786 的原名为「愛の奇跡ドクターノーマン物語」，日期为1982-12-24，剧情与 Bangumi 完全对应，片长85分钟；TMDB标为电影，且导演Masami Anno与外部资料中的案納正美对应。外部资料确认这是国際映画社制作的TV特别篇，单个完整作品而非普通季度TV、OVA或合集。因此应映射为 movie，集数字段全部为 null。\n\nhttps://www.themoviedb.org/movie/1448786 (api_snapshot): TMDB详情：原名「愛の奇跡ドクターノーマン物語」、日期1982-12-24、剧情为Oppenheimer以Norman为名生活并处理贫民窟土地开发事件、片长85分钟、导演Masami Anno。\n\nhttps://api.bgm.tv/v0/subjects/220083 (api_snapshot): Bangumi API：日期1982-12-24、平台TV、1话、85分钟；简介和TMDB剧情相符。\n\nhttps://animedb.moe/anime/series/741 (search_snippet): 外部资料标为TVスペシャル，1982-12-24、85分钟，并列出案納正美/长谷川康雄、天野嘉孝等制作人员。\n\nhttps://www.allcinema.net/cinema/pdf/235157 (search_snippet): 外部资料标为1982年TV动画特别节目，确认剧情、播出日期、导演案納正美、角色设计天野嘉孝及国際映画社相关制作信息。\n\n脚本生成逐集规则：单一本篇章节对应整部电影。",
    "method": "codex",
    "source": "https://bgm.tv/subject/220083; https://www.themoviedb.org/movie/1448786; https://api.bgm.tv/v0/subjects/220083; https://animedb.moe/anime/series/741; https://www.allcinema.net/cinema/pdf/235157",
    "verifiedAt": "2026-09-16T00:25:53.274Z"
  },
  "rules": [],
  "schemaVersion": 1,
  "targets": [
    {
      "id": 1448786,
      "type": "movie"
    }
  ]
}
