{
  "bangumiId": 124630,
  "episodes": [
    {
      "id": 909455,
      "sort": 1,
      "type": 0
    }
  ],
  "locked": false,
  "overrides": [
    {
      "bangumiEpisodeId": 909455,
      "targets": [
        {
          "id": 331429,
          "type": "movie"
        }
      ]
    }
  ],
  "provenance": {
    "evidence": "gpt-5.6-luna: TMDB 331429 与 Bangumi 条目同名，日期均为 2015-01-31，片长均为 86 分钟；剧情均描述喜羊羊、懒羊羊因误会回到远古时代并对抗恶龙。导演黄伟明一致，制作方均包含上海电影集团。该条目是独立剧场版电影，不应映射为 TV 季或其他系列电影。\n\nhttps://api.bgm.tv/v0/subjects/124630 (api_snapshot): Bangumi API 确认作品为 2015-01-31 上映、86 分钟、剧场版、1 话；导演为黄伟明；剧情涉及回到远古时代并对抗恶龙。\n\nhttps://www.themoviedb.org/movie/331429 (api_snapshot): TMDB 详情确认电影原名为《喜羊羊与灰太狼之羊年喜羊羊》，日期 2015-01-31，片长 86 分钟，剧情与 Bangumi 一致，导演为黄伟明。\n\nhttps://www.themoviedb.org/movie/331429 (api_snapshot): TMDB 别名包含“羊年喜羊羊”和“喜羊羊与灰太狼大电影之羊年喜羊羊”，制作公司包含 Shanghai Film Group。\n\n脚本生成逐集规则：单一本篇章节对应整部电影。",
    "method": "codex",
    "source": "https://bgm.tv/subject/124630; https://api.bgm.tv/v0/subjects/124630; https://www.themoviedb.org/movie/331429",
    "verifiedAt": "2026-09-16T00:25:53.274Z"
  },
  "rules": [],
  "schemaVersion": 1,
  "targets": [
    {
      "id": 331429,
      "type": "movie"
    }
  ]
}
