{
  "bangumiId": 282028,
  "episodes": [
    {
      "id": 909408,
      "sort": 1,
      "type": 0
    }
  ],
  "locked": false,
  "overrides": [
    {
      "bangumiEpisodeId": 909408,
      "targets": [
        {
          "id": 457249,
          "type": "movie"
        }
      ]
    }
  ],
  "provenance": {
    "evidence": "脚本按上映日期识别电影：以「Vixen: The Movie」「雌狐：大电影」搜索得到 0 个 TV、1 个电影候选；movie/457249「Vixen: The Movie」上映日期 2017-05-08 与 Bangumi 放送日期相差不超过 3 天，且是唯一吻合的候选。",
    "method": "deterministic",
    "source": "https://bgm.tv/subject/282028; https://www.themoviedb.org/movie/457249",
    "verifiedAt": "2026-09-18T11:24:20.473Z"
  },
  "rules": [],
  "schemaVersion": 1,
  "targets": [
    {
      "id": 457249,
      "type": "movie"
    }
  ]
}
