{
  "bangumiId": 317777,
  "episodes": [
    {
      "id": 985742,
      "sort": 1,
      "type": 0
    }
  ],
  "locked": false,
  "overrides": [
    {
      "bangumiEpisodeId": 985742,
      "targets": [
        {
          "id": 856179,
          "type": "movie"
        }
      ]
    }
  ],
  "provenance": {
    "evidence": "gpt-6-sol: 片名、1927年上映年份、12分钟片长、画室纸人剧情及万氏兄弟制作背景一致；Bangumi 唯一的本篇章节对应 TMDB 的单部电影。《纸人捣乱记》是另一部作品。\n\nhttps://www.themoviedb.org/movie/856179 (api_snapshot): TMDB 以《大闹画室》检索得到电影 ID 856179，列为1927年作品，简介描述画室中的纸人跳出画面捣乱。\n\nhttps://www.themoviedb.org/movie/856179 (api_snapshot): TMDB 电影详情记载片长12分钟、导演万古蟾，剧情为画室主人制服纸人。\n\nhttps://mzj.sh.gov.cn/lnb-wsws/20221017/f806a308e6e44369be26d092ac597f0c.html (page): 上海市民政局文章记载：《大闹画室》由长城画片公司邀请万氏兄弟制作，片长12分钟，真人与动画结合，画家与跳出画板的小人追逐打闹；文章称影片于翌年5月上映，并将1930年的《纸人捣乱记》列为另一部作品。\n\n备注：TMDB 将上映日期记为1927年1月1日，上海市民政局文章称1927年5月上映；具体上映日未核实，不影响作品对应。",
    "method": "codex",
    "source": "https://bgm.tv/subject/317777; https://www.themoviedb.org/movie/856179; https://mzj.sh.gov.cn/lnb-wsws/20221017/f806a308e6e44369be26d092ac597f0c.html",
    "verifiedAt": "2026-10-08T02:04:29.864Z"
  },
  "rules": [],
  "schemaVersion": 1,
  "targets": [
    {
      "id": 856179,
      "type": "movie"
    }
  ]
}
