{
  "bangumiId": 499155,
  "episodes": [
    {
      "id": 1420495,
      "sort": 1,
      "type": 0
    }
  ],
  "locked": false,
  "overrides": [
    {
      "bangumiEpisodeId": 1420495,
      "targets": [
        {
          "id": 1299652,
          "type": "movie"
        }
      ]
    }
  ],
  "provenance": {
    "evidence": "codex: 确认对应2024年动画电影《Watchmen: Chapter II》。发行日期、动画媒介、原作、制作公司、剧情及制作人员相互吻合；本作仅覆盖两部曲的第二部，唯一章节对应整部电影，无季号。\n\nhttps://bgm.tv/subject/499155 (page): Bangumi 标注本作共1话，2024年11月26日发行，原作为 Alan Moore、制作为 Paramount Pictures，前传为《The Watchmen Chapter 1》。\n\nhttps://www.themoviedb.org/movie/1299652 (api_snapshot): TMDB 电影1299652为《Watchmen: Chapter II》，时长89分钟，导演 Brandon Vietti，制作公司包括 Warner Bros. Animation、Paramount Pictures 和 DC；剧情为夜枭与丝魂调查可能引发全球核战争的阴谋。\n\nhttps://paramountglobalcontent.com/title/watchmen-chapter-2 (page): Paramount 官方列为动画长片，首发日期2024年11月26日，约90分钟；剧情及 Matthew Rhys、Katee Sackhoff、Titus Welliver 的配音角色与 TMDB 一致。\n\nhttps://www.dc.com/movies/watchmen-chapter-ii-2024 (search_snippet): DC 官方搜索摘要确认这是2024年的第二章电影，完成原作漫画改编，导演为 Brandon Vietti，编剧为 J. Michael Straczynski。\n\n备注：TMDB 主日期为2024年11月25日，比 Bangumi 与 Paramount 官方首发日期早一天；差异原因未确认，不影响版本识别。",
    "method": "codex",
    "source": "https://bgm.tv/subject/499155; https://www.themoviedb.org/movie/1299652; https://paramountglobalcontent.com/title/watchmen-chapter-2; https://www.dc.com/movies/watchmen-chapter-ii-2024",
    "verifiedAt": "2026-09-18T12:53:11.022Z"
  },
  "rules": [],
  "schemaVersion": 1,
  "targets": [
    {
      "id": 1299652,
      "type": "movie"
    }
  ]
}
