{
  "bangumiId": 652153,
  "episodes": [
    {
      "id": 1693495,
      "sort": 1,
      "type": 0
    }
  ],
  "locked": false,
  "overrides": [
    {
      "bangumiEpisodeId": 1693495,
      "targets": [
        {
          "id": 472983,
          "type": "movie"
        }
      ]
    }
  ],
  "provenance": {
    "evidence": "脚本按上映日期识别电影：以「Invader ZIM: Enter the Florpus」搜索得到 0 个 TV、1 个电影候选；movie/472983「Invader Zim: Enter the Florpus」上映日期 2019-08-16 与 Bangumi 放送日期相差不超过 3 天，且是唯一吻合的候选。",
    "method": "deterministic",
    "source": "https://bgm.tv/subject/652153; https://www.themoviedb.org/movie/472983",
    "verifiedAt": "2026-09-18T11:24:20.473Z"
  },
  "rules": [],
  "schemaVersion": 1,
  "targets": [
    {
      "id": 472983,
      "type": "movie"
    }
  ]
}
