{
  "bangumiId": 632318,
  "episodes": [
    {
      "id": 1653503,
      "sort": 1,
      "type": 0
    }
  ],
  "locked": false,
  "overrides": [
    {
      "bangumiEpisodeId": 1653503,
      "targets": [
        {
          "id": 48466,
          "type": "movie"
        }
      ]
    }
  ],
  "provenance": {
    "evidence": "脚本按上映日期识别电影：以「Scared Shrekless」「史莱克的万圣节游戏」搜索得到 0 个 TV、1 个电影候选；movie/48466「Scared Shrekless」上映日期 2010-10-28 与 Bangumi 放送日期相差不超过 3 天，且是唯一吻合的候选。",
    "method": "deterministic",
    "source": "https://bgm.tv/subject/632318; https://www.themoviedb.org/movie/48466",
    "verifiedAt": "2026-09-18T19:06:50.005Z"
  },
  "rules": [],
  "schemaVersion": 1,
  "targets": [
    {
      "id": 48466,
      "type": "movie"
    }
  ]
}
