{
  "bangumiId": 87390,
  "episodes": [
    {
      "id": 876706,
      "sort": 1,
      "type": 0
    }
  ],
  "locked": false,
  "overrides": [
    {
      "bangumiEpisodeId": 876706,
      "targets": [
        {
          "id": 347182,
          "type": "movie"
        }
      ]
    }
  ],
  "provenance": {
    "evidence": "脚本按上映日期识别电影：以「明治東亰恋伽 ～弦月の小夜曲～」「明治东京恋伽～弦月的小夜曲～」搜索得到 0 个 TV、1 个电影候选；movie/347182「劇場版「明治東亰恋伽」～弦月の小夜曲～」上映日期 2015-07-18 与 Bangumi 放送日期相差不超过 3 天，且是唯一吻合的候选。",
    "method": "deterministic",
    "source": "https://bgm.tv/subject/87390; https://www.themoviedb.org/movie/347182",
    "verifiedAt": "2026-09-18T19:06:50.005Z"
  },
  "rules": [],
  "schemaVersion": 1,
  "targets": [
    {
      "id": 347182,
      "type": "movie"
    }
  ]
}
