{
  "bangumiId": 522411,
  "episodes": [],
  "locked": false,
  "overrides": [],
  "provenance": {
    "evidence": "gpt-6-sol: 作品原名、剧场版媒介、前日谈剧情、导演和制作公司相符，可对应 TMDB 独立电影 1695893。Bangumi 尚无章节，无逐集规则。\n\nhttps://www.themoviedb.org/movie/1695893 (api_snapshot): TMDB 电影 1695893 的原名为《機動戦士ガンダムSEED FREEDOM ZERO》，状态为制作中，制作公司包括 SUNRISE 和 Bandai Namco Filmworks，导演为福田己津央；TMDB 尚未填写上映日期和剧情简介。\n\nhttps://gundam-official.com/seed/freedom/news/item.php?id=u41ricmmmttp4p014dosmk9p (page): 作品官网确认这是一部定于2027年1月15日上映的剧场版，是《SEED FREEDOM》的前日谈；其 C.E.74 剧情、导演及编剧均与 Bangumi 条目吻合。\n\nhttps://bgm.tv/subject/522411 (page): Bangumi 条目记载相同剧情和制作人员，但将上映日期写为2027年1月17日。\n\n备注：Bangumi 的上映日期为2027年1月17日，官网公布的日本首映日期为2027年1月15日；TMDB 目前未填上映日期。",
    "method": "codex",
    "source": "https://bgm.tv/subject/522411; https://www.themoviedb.org/movie/1695893; https://gundam-official.com/seed/freedom/news/item.php?id=u41ricmmmttp4p014dosmk9p",
    "verifiedAt": "2026-10-09T02:18:29.631Z"
  },
  "rules": [],
  "schemaVersion": 1,
  "targets": [
    {
      "id": 1695893,
      "type": "movie"
    }
  ]
}
