{
  "bangumiId": 577000,
  "episodes": [
    {
      "id": 1551624,
      "sort": 1,
      "type": 0
    }
  ],
  "locked": false,
  "overrides": [
    {
      "bangumiEpisodeId": 1551624,
      "targets": [
        {
          "id": 861048,
          "type": "movie"
        }
      ]
    }
  ],
  "provenance": {
    "evidence": "脚本按上映日期识别电影：以「ネオ・ファウスト」「新浮士德」搜索得到 0 个 TV、1 个电影候选；movie/861048「ネオ・ファウスト」上映日期 1999-01-15 与 Bangumi 放送日期相差不超过 3 天，且是唯一吻合的候选。",
    "method": "deterministic",
    "source": "https://bgm.tv/subject/577000; https://www.themoviedb.org/movie/861048",
    "verifiedAt": "2026-09-19T11:52:44.754Z"
  },
  "rules": [],
  "schemaVersion": 1,
  "targets": [
    {
      "id": 861048,
      "type": "movie"
    }
  ]
}
