{
  "bangumiId": 484023,
  "episodes": [
    {
      "id": 1311849,
      "sort": 1,
      "type": 0
    },
    {
      "id": 1311850,
      "sort": 1,
      "type": 4
    }
  ],
  "locked": false,
  "overrides": [
    {
      "bangumiEpisodeId": 1311849,
      "targets": [
        {
          "id": 1324285,
          "type": "movie"
        }
      ]
    }
  ],
  "provenance": {
    "evidence": "gpt-5.6-luna: TMDB 条目与 Bangumi 主体的日文原名、2024-03-09 日期、剧情、京都动画制作及导演山村卓也均吻合；TMDB简介明确为宇治宣传动画，片长约7分钟，与 Bangumi 的6分30秒本篇一致。因此对应单部 movie，不是 TV 或季度作品。宇治市官方页面还确认存在独立的30秒短版；该短版是 Bangumi 的 special，不应误当作另一季或本篇集数。\n\nhttps://www.themoviedb.org/movie/1324285 (api_snapshot): TMDB 详情：原名「うじには物語がある」、日期2024-03-09、剧情为宇治历史文化宣传视频、片长7分钟、制作公司Kyoto Animation、导演山村卓也。\n\nhttps://www.city.uji.kyoto.jp/site/murasaki/70217.html (page): 宇治市官方页面确认本篇「うじには物語がある」为约6分钟的京都动画PR视频，并另有30秒short版；剧情为主人公游历并了解宇治各时代历史文化。\n\n备注：未找到30秒short版的独立TMDB条目；推荐目标覆盖本篇movie，Bangumi中的short版special不作为额外TMDB集数处理。\n\n脚本生成逐集规则：单一本篇章节对应整部电影。",
    "method": "codex",
    "source": "https://bgm.tv/subject/484023; https://www.themoviedb.org/movie/1324285; https://www.city.uji.kyoto.jp/site/murasaki/70217.html",
    "verifiedAt": "2026-09-17T00:37:35.487Z"
  },
  "rules": [],
  "schemaVersion": 1,
  "targets": [
    {
      "id": 1324285,
      "type": "movie"
    }
  ]
}
