{
  "bangumiId": 189291,
  "episodes": [
    {
      "id": 913138,
      "sort": 1,
      "type": 0
    }
  ],
  "locked": false,
  "overrides": [
    {
      "bangumiEpisodeId": 913138,
      "targets": [
        {
          "id": 281638,
          "type": "movie"
        }
      ]
    }
  ],
  "provenance": {
    "evidence": "脚本按上映日期识别电影：以「Ter land, ter zee en in de lucht」「陆地、海洋和天空」搜索得到 1 个 TV、1 个电影候选；movie/281638「Te land, ter zee en in de lucht」上映日期 1980-01-01 与 Bangumi 放送日期相差不超过 3 天，且是唯一吻合的候选。",
    "method": "deterministic",
    "source": "https://bgm.tv/subject/189291; https://www.themoviedb.org/movie/281638",
    "verifiedAt": "2026-09-28T00:54:41.324Z"
  },
  "rules": [],
  "schemaVersion": 1,
  "targets": [
    {
      "id": 281638,
      "type": "movie"
    }
  ]
}
