{
  "bangumiId": 579395,
  "episodes": [
    {
      "id": 1556287,
      "sort": 1,
      "type": 0
    }
  ],
  "locked": false,
  "overrides": [
    {
      "bangumiEpisodeId": 1556287,
      "targets": [
        {
          "id": 1156418,
          "type": "movie"
        }
      ]
    }
  ],
  "provenance": {
    "evidence": "脚本按上映日期识别电影：以「マッツとヤンマとモブリさん2 水軍お宝と謎解きの島々」「Mattsu to Yanma to Moburi-san 2: Suigun Otakara to Nazotoki no Shimajima」搜索得到 0 个 TV、1 个电影候选；movie/1156418「Mattsu to Yanma to Moburi-san 2: Suigun Otakara to Nazotoki no Shimajima」上映日期 2014-10-23 与 Bangumi 放送日期相差不超过 3 天，且是唯一吻合的候选。",
    "method": "deterministic",
    "source": "https://bgm.tv/subject/579395; https://www.themoviedb.org/movie/1156418",
    "verifiedAt": "2026-09-18T19:06:50.005Z"
  },
  "rules": [],
  "schemaVersion": 1,
  "targets": [
    {
      "id": 1156418,
      "type": "movie"
    }
  ]
}
