{
  "bangumiId": 178602,
  "episodes": [
    {
      "id": 628739,
      "sort": 1,
      "type": 0
    }
  ],
  "locked": false,
  "overrides": [
    {
      "bangumiEpisodeId": 628739,
      "targets": [
        {
          "id": 546469,
          "type": "movie"
        }
      ]
    }
  ],
  "provenance": {
    "evidence": "脚本按上映日期识别电影：以「马小乐之玩具也疯狂」「Ma Xiaole and His Toys」搜索得到 0 个 TV、1 个电影候选；movie/546469「马小乐之玩具也疯狂」上映日期 2016-04-30 与 Bangumi 放送日期相差不超过 3 天，且是唯一吻合的候选。",
    "method": "deterministic",
    "source": "https://bgm.tv/subject/178602; https://www.themoviedb.org/movie/546469",
    "verifiedAt": "2026-09-18T19:06:50.005Z"
  },
  "rules": [],
  "schemaVersion": 1,
  "targets": [
    {
      "id": 546469,
      "type": "movie"
    }
  ]
}
