{
  "bangumiId": 585874,
  "episodes": [],
  "locked": false,
  "overrides": [],
  "provenance": {
    "evidence": "gpt-6-sol: 原名、1946 年上映年份、导演、动画电影媒介及士兵与魔法打火匣的剧情相符，可对应 TMDB 电影 211649。Bangumi 没有可供逐集映射的章节。\n\nhttps://bgm.tv/subject/585874 (page): Bangumi 将《Fyrtøjet》列为 1946 年的剧场版，导演为 Svend Methling，别名为《Magic Lighter》，片长标为 61 分钟。\n\nhttps://www.themoviedb.org/movie/211649 (api_snapshot): TMDB 电影 211649 的原名为《Fyrtøjet》，上映日期为 1946 年 5 月 16 日，导演为 Svend Methling；剧情是士兵借魔法打火匣争取公主，片长标为 71 分钟。\n\nhttps://www.scope.dk/film/10034-fyrtoejet (page): 丹麦电影资料站 Scope 将同名作品列为 1946 年动画电影，首映日期、导演、主要配音演员和剧情均与 TMDB 条目一致，片长为 71 分钟。\n\nhttps://www.themoviedb.org/movie/687307 (api_snapshot): TMDB 搜索还返回原名相同但上映于 1907 年的电影 687307；其年份与本条目不符。\n\n备注：Bangumi 标注片长 61 分钟，TMDB 与 Scope 均标注 71 分钟；现有资料未说明差异原因。",
    "method": "codex",
    "source": "https://bgm.tv/subject/585874; https://www.themoviedb.org/movie/211649; https://www.scope.dk/film/10034-fyrtoejet; https://www.themoviedb.org/movie/687307",
    "verifiedAt": "2026-10-20T01:13:32.625Z"
  },
  "rules": [],
  "schemaVersion": 1,
  "targets": [
    {
      "id": 211649,
      "type": "movie"
    }
  ]
}
