{
  "bangumiId": 178855,
  "episodes": [
    {
      "id": 932491,
      "sort": 1,
      "type": 0
    }
  ],
  "locked": false,
  "overrides": [
    {
      "bangumiEpisodeId": 932491,
      "targets": [
        {
          "id": 997684,
          "type": "movie"
        }
      ]
    }
  ],
  "provenance": {
    "evidence": "gpt-6-sol: Bangumi条目是1998年上映、共1话的电影；候选电影《雪狐》片名及上映年份一致，媒介也相符。名称相近的电视剧在集数和媒介上均不符。\n\nhttps://www.themoviedb.org/movie/997684 (api_snapshot): 电影《雪狐》上映日期为1998-06-01，与Bangumi条目的片名、1998年上映年份及电影媒介相符。\n\nhttps://www.themoviedb.org/tv/97202 (api_snapshot): 名称相近的《雪山飛狐》候选为多集电视剧；例如1999年版本第1季有40集。\n\n备注：候选电影未提供剧情、片长和制作人员，无法据此进一步交叉核对。\n\n脚本生成逐集规则：单一本篇章节对应整部电影。",
    "method": "codex",
    "source": "https://bgm.tv/subject/178855; https://www.themoviedb.org/movie/997684; https://www.themoviedb.org/tv/97202",
    "verifiedAt": "2026-10-05T01:03:48.613Z"
  },
  "rules": [],
  "schemaVersion": 1,
  "targets": [
    {
      "id": 997684,
      "type": "movie"
    }
  ]
}
