{
  "bangumiId": 659182,
  "episodes": [
    {
      "id": 1702584,
      "sort": 1,
      "type": 0
    }
  ],
  "locked": false,
  "overrides": [
    {
      "bangumiEpisodeId": 1702584,
      "targets": [
        {
          "id": 1594694,
          "type": "movie"
        }
      ]
    }
  ],
  "provenance": {
    "evidence": "脚本按上映日期识别电影：以「Lydia et le vaisseau des tempêtes」「迷雾之海的莉迪亚」「Lydia and the Mist Rider」搜索得到 0 个 TV、1 个电影候选；movie/1594694「Lydia et le vaisseau des tempêtes」上映日期 2026-02-20 与 Bangumi 放送日期相差不超过 30 天且标题一致，且是唯一吻合的候选。",
    "method": "deterministic",
    "source": "https://bgm.tv/subject/659182; https://www.themoviedb.org/movie/1594694",
    "verifiedAt": "2026-09-18T11:24:20.473Z"
  },
  "rules": [],
  "schemaVersion": 1,
  "targets": [
    {
      "id": 1594694,
      "type": "movie"
    }
  ]
}
