{
  "bangumiId": 421432,
  "episodes": [
    {
      "id": 1429689,
      "sort": 1,
      "type": 0
    }
  ],
  "locked": false,
  "overrides": [
    {
      "bangumiEpisodeId": 1429689,
      "targets": [
        {
          "id": 1090213,
          "type": "movie"
        }
      ]
    }
  ],
  "provenance": {
    "evidence": "codex: 完整致敬片名、电影媒介和多名角色的具体剧情共同支持匹配1090213，足以区别同名旧作及1933年原作。Bangumi仅有一个本篇章节，对应整部电影，无需建立季或连续集号规则。\n\nhttps://www.themoviedb.org/movie/1090213 (api_snapshot): 候选完整片名与 Bangumi 一致，仅书名号形式不同；简介中的寡妇お鈴、利用她追查鼠小僧的梵字安五郎与長五郎、捕快勘右衛門及江户背景均吻合，支持为同一部致敬山中贞雄的电影。\n\nhttps://www.themoviedb.org/movie/499852 (api_snapshot): 候选《鼠小僧次郎吉・江戸の巻》日期为1933-11-28，对应 Bangumi 简介所述原作电影的名称及年代，应与本次动画改编区分。\n\n备注：TMDB日期为2023-03-20，Bangumi上映日期为2024-11-23；快照未提供各地上映或影展记录，无法确认日期差异的原因。；候选未提供片长、制作方和主创字段，无法独立交叉核验这些信息；唯一章节也没有标题或放送日期，其对应依据是单篇电影的整体身份。",
    "method": "codex",
    "source": "https://bgm.tv/subject/421432; https://www.themoviedb.org/movie/1090213; https://www.themoviedb.org/movie/499852",
    "verifiedAt": "2026-09-18T11:24:20.473Z"
  },
  "rules": [],
  "schemaVersion": 1,
  "targets": [
    {
      "id": 1090213,
      "type": "movie"
    }
  ]
}
